title,url,permalink,score,subreddit
The man who sold fractional shares in himself,https://decrypt.co/25980/alex-mamsej-fractional-shares-ethereum?utm_source=reddit&utm_medium=social&utm_campaign=sm,https://reddit.com/r/weirdnews/comments/g4thnf/the_man_who_sold_fractional_shares_in_himself/,14,weirdnews
Video: Does the Vatican show a hologram instead of a real Pope?,https://anomalien.com/video-does-the-vatican-show-a-hologram-instead-of-a-real-po,https://reddit.com/r/weirdnews/comments/g2h9di/video_does_the_vatican_show_a_hologram_instead_of/,30,weirdnews
"Pregnant goat dies after being gangraped by eight men, Haroon and Jaffar amongst accused WTF???",https://www.opindia.com/2018/07/haryana-pregnant-goat-dies-after-being-gangraped-by-eight-men-haroon-and-jaffar-amongst-accused/,https://reddit.com/r/weirdnews/comments/g2aizi/pregnant_goat_dies_after_being_gangraped_by_eight/,15,weirdnews
Two Headed Goat Born At Wisconsin,http://www.thewiseherb.com/two-headed-goat-born-at-wisconsin/,https://reddit.com/r/weirdnews/comments/g29h1t/two_headed_goat_born_at_wisconsin/,19,weirdnews
Staying home and reading this type of inventions,https://m.9gag.com/gag/az10Vqp,https://reddit.com/r/weirdnews/comments/g1yto5/staying_home_and_reading_this_type_of_inventions/,6,weirdnews
"Kevin Spacey demands release of all Jeffrey Epstein files, says he has 'nothing to fear'",https://www.foxnews.com/entertainment/kevin-spacey-demands-release-all-jeffrey-epstein-files-says-he-has-nothing-fear,https://reddit.com/r/nottheonion/comments/1m1k28t/kevin_spacey_demands_release_of_all_jeffrey/,25759,nottheonion
"Forget copyright strikes, a retro gaming YouTuber faces jail time for reviewing gaming handhelds",https://www.androidauthority.com/once-were-nerd-youtuber-copyright-lawsuit-3577995/,https://reddit.com/r/nottheonion/comments/1m1cdu2/forget_copyright_strikes_a_retro_gaming_youtuber/,7167,nottheonion
Hawley seeks to repeal Medicaid cuts he voted for,https://thehill.com/policy/healthcare/5402636-hawley-seeks-to-repeal-medicaid-cuts-he-voted-for/,https://reddit.com/r/nottheonion/comments/1m1gy8s/hawley_seeks_to_repeal_medicaid_cuts_he_voted_for/,3208,nottheonion
Howard Lutnick's Ties to Jeffrey Epstein Come Under Scrutiny,https://www.newsweek.com/howard-lutnick-epstein-ties-2099660,https://reddit.com/r/nottheonion/comments/1m1ily9/howard_lutnicks_ties_to_jeffrey_epstein_come/,1449,nottheonion
Thai woman arrested for blackmailing monks after sex with thousands of videos,https://www.bbc.com/news/articles/cjelg7q845zo,https://reddit.com/r/nottheonion/comments/1m1du9s/thai_woman_arrested_for_blackmailing_monks_after/,1343,nottheonion
